{
  "uid": "switch-widget",
  "version": "1.0.0",
  "status": "beta",
  "type": "widget",
  "name": "Switch",
  "description": "Switch widget for Asterisc",
  "keywords": ["asterisc", "plugin", "widget", "switch"],
  "main": "https://raw.githubusercontent.com/asteriscio/plugins/main/packages/web-components/switch/src/index.js",
  "links": [
    {
      "rel": "icon",
      "href": "https://raw.githubusercontent.com/asteriscio/plugins/main/packages/web-components/switch/src/assets/icon.svg"
    },
    {
      "rel": "screenshot",
      "src": "https://raw.githubusercontent.com/asteriscio/plugins/main/packages/web-components/eventlog/src/assets/images/screenshot.png"
    },
    {
      "rel": "author",
      "href": "https://asterisc.io",
      "title": "Asterisc GmbH"
    },
    {
      "rel": "homepage",
      "href": "https://github.com/asteriscio/plugins/tree/main/packages/web-components/switch"
    },
    {
      "rel": "repository",
      "href": "https://github.com/asteriscio/plugins"
    },
    {
      "rel": "license",
      "href": "https://raw.githubusercontent.com/asteriscio/plugins/main/packages/web-components/switch/LICENSE"
    }
  ]
}
