{
  "uid": "chart-widget",
  "version": "1.0.0",
  "type": "widget",
  "name": "Chart",
  "description": "Chart widget for Asterisc",
  "keywords": ["asterisc", "plugin", "widget", "chart"],
  "main": "https://raw.githubusercontent.com/asteriscio/plugins/main/packages/web-components/chart/src/index.js",
  "links": [
    {
      "rel": "icon",
      "href": "https://raw.githubusercontent.com/asteriscio/plugins/main/packages/web-components/chart/src/assets/icon.svg",
      "type": "image/svg"
    },
    {
      "rel": "author",
      "href": "https://asterisc.io",
      "type": "text/html"
    },
    {
      "rel": "homepage",
      "href": "https://github.com/asteriscio/plugins/tree/main/packages/web-components/chart",
      "type": "text/html"
    },
    {
      "rel": "repository",
      "href": "https://github.com/asteriscio/plugins",
      "type": "text/html"
    },
    {
      "rel": "license",
      "href": "https://raw.githubusercontent.com/asteriscio/plugins/main/packages/web-components/chart/LICENSE",
      "type": "text/html"
    }
  ]
}
