{
  "uid": "map-widget",
  "version": "1.0.0",
  "type": "widget",
  "name": "Map",
  "description": "Map widget for Asterisc",
  "keywords": ["asterisc", "plugin", "widget", "map"],
  "main": "https://raw.githubusercontent.com/asteriscio/plugins/main/packages/web-components/map/src/index.js",
  "links": [
    {
      "rel": "icon",
      "href": "https://raw.githubusercontent.com/asteriscio/plugins/main/packages/web-components/map/src/assets/icon.svg",
      "type": "image/svg"
    },
    {
      "rel": "screenshot",
      "src": "https://raw.githubusercontent.com/asteriscio/plugins/main/packages/web-components/eventlog/src/assets/images/screenshot.png",
      "type": "image/png"
    },
    {
      "rel": "author",
      "href": "https://asterisc.io",
      "type": "text/html"
    },
    {
      "rel": "homepage",
      "href": "https://github.com/asteriscio/plugins/tree/main/packages/web-components/map",
      "type": "text/html"
    },
    {
      "rel": "repository",
      "href": "https://github.com/asteriscio/plugins",
      "type": "text/html"
    },
    {
      "rel": "license",
      "href": "https://raw.githubusercontent.com/asteriscio/plugins/main/packages/web-components/map/LICENSE",
      "type": "text/html"
    }
  ]
}
